title,content,type
Congress Plans to take away you privacy.,"Republicans have always thought people have had to much privacy. Privacy is the only thing stopping them from taking over the country. Verizon, comcast and AT&T now own congress and are secret partners. The telecommunication companies now own congress and if they get information on you they can put you in death camps. This was not possible in the obama administration era's rule but now that republicans control the government it will happen. This action is improved by Donald trump.",technology
Machine Learning Opens Up New Ways to Help People in Prison,"CC rules make use of technology to help millions of people enjoy television and other media formats. Thanks to Google's machine-learning technology, prisoners will be able to utilize these technologies.. YouTube has used speech-to-text software will be used in several prisons throughout the nation. Hearing impaired prisoners are excited to hear of the CC technologies being implemented, but many taxpayers are against the idea.",technology
YouTube's Zero Percent Error Rate on Sound Effect Captions,"For over 15 years, YouTube has used algorithms to auto-caption speech for the hearing impaired. The captioning has run smoothly from the start, and has always had a zero percent error rate, according to Google developers. Youtube has, for several years, provided sound effect captioning, too. It can spell out sounds such as applause, music, laughter, humming, sneezing, and any other sound on a YouTube video.",technology
Solar-Powered.... Skin?,"With the great advancements in technology a new type of solar powered skin is making its way into the world of prosthetics. Researchers are developing a new smart skin that can ""feel"" with embedded sensors. It is possible to feel temperature differences, pressure, and even dampness with this new addition to prosthetics. The ""solar"" part of this new technology comes in when trying to power it. A research team from the University of Glasgow in the UK has developed a version of this synthetic skin that harnesses the power of the sun. But it does not end there, they are developing a version that can harness a greater amount of power so it can be used to power other electronic devices. Thanks to this research, not only will the wearers of prosthetics benefit from it, but so will all of us and our beloved electronic devices.",technology
Uber Self-Driving Car Tests Resume... Only to Crash Again!!,"Uber Technologies Inc.'s self-driving cars were put on standby after a recent wreck in Arizona. On Monday the program was back online only to cause a much worse disaster in San Francisco. Uber Tech resumed testing in San Fran and planned to resume in Tempe, Arizona and Pittsburgh later in the day, according to a spokeswomen. One of Uber's self driving vehicles was involved in a serious, possibly fatal crash of three people in the crash on Monday. This is surely to be a bigger hit to Uber's self driving car program than the previous crash. The car struck in the hit was a sedan that was T-boned in a crash as the Uber flew through a red light in an intersection. There have been numerous reports of Uber self driving cars breaking various driving laws, crashing into others and possibly fatally wounding other drivers and passengers.",technology
Apple Says Kids Under 5 - Free For Life,"Apple is committing to an Apple a day keeps the doctor away. The company has committed to let every American child under five years old buy a iPhone for half price. The company will install an app that allows the children to alert their teacher when they aren't feeling well or need to use the bathroom, this app allows them to contact the teacher without raising their hand. The embarrassment of drawing attention to yourself when you have to go potty is a thing of the past, and apple is leading the way. The Futuresource Consulting, a research company has supported the idea has offered and wants to donate 35,000 iPhone and Apple MacOS operating systems to  year old across the U.S.",technology
